{
  "$schema": "https://json-schema.org/draft/2020-12/schema",
  "title": "Workbench objective notepad",
  "description": "Structural interchange contract. Labels are not authority or evidence of truth. Runtime additionally checks duplicate entry IDs and update/dependency safety.",
  "type": "object",
  "required": [
    "schema_version",
    "revision",
    "id",
    "type",
    "status",
    "title",
    "created_at",
    "updated_at",
    "objective",
    "current",
    "entries",
    "extensions"
  ],
  "properties": {
    "schema_version": {
      "const": "notepad-1"
    },
    "revision": {
      "type": "integer",
      "minimum": 1
    },
    "id": {
      "type": "string",
      "minLength": 1
    },
    "type": {
      "type": "string",
      "minLength": 1
    },
    "status": {
      "enum": [
        "PROVISIONAL",
        "ACTIVE",
        "BLOCKED",
        "RECONCILED"
      ]
    },
    "title": {
      "type": "string",
      "minLength": 1
    },
    "created_at": {
      "type": "string",
      "minLength": 1
    },
    "updated_at": {
      "type": "string",
      "minLength": 1
    },
    "objective": {
      "type": "object",
      "required": [
        "key"
      ],
      "properties": {
        "key": {
          "type": "string"
        },
        "focus": {
          "type": "string"
        }
      }
    },
    "current": {
      "type": "object",
      "required": [
        "state"
      ],
      "properties": {
        "state": {
          "type": "string"
        },
        "unresolved": {
          "type": "array"
        },
        "next_action": {
          "type": "string"
        }
      }
    },
    "relationships": {
      "type": "object"
    },
    "entries": {
      "type": "array",
      "items": {
        "type": "object",
        "required": [
          "id",
          "kind",
          "topic",
          "content"
        ],
        "properties": {
          "id": {
            "type": "string",
            "pattern": "^[A-Za-z0-9]+(?:[-_][A-Za-z0-9]+)*$"
          },
          "kind": {
            "enum": [
              "directive",
              "source_record",
              "finding",
              "proposal",
              "decision",
              "correction",
              "verification",
              "blocker"
            ]
          },
          "topic": {
            "type": "string"
          },
          "content": {
            "type": "string"
          }
        }
      }
    },
    "extensions": {
      "type": "object"
    }
  }
}
